{
  "version": "ob-comparison-fixture/v1",
  "description": "Implementation removes an operation present in the contract.",
  "left": {
    "openbindings": "0.2.0",
    "operations": {
      "check": {
        "output": {
          "type": "string"
        }
      },
      "old": {
        "output": {
          "type": "string"
        }
      }
    }
  },
  "right": {
    "openbindings": "0.2.0",
    "operations": {
      "check": {
        "output": {
          "type": "string"
        }
      }
    }
  },
  "mode": "subsume",
  "options": {
    "profile": "OB-2020-12"
  },
  "expected": {
    "format_version": "ob-comparison-report/v1",
    "profile": "OB-2020-12@<corpus-sha>",
    "mode": "subsume",
    "tool": {
      "name": "ob",
      "version": "<tool.version>"
    },
    "generated_at": "<generated_at>",
    "inputs": {
      "left": {
        "source": "file",
        "uri": "<input.left.uri>",
        "content_sha256": "86ea7a54fcc46d7e2d9fdca870faf998cc85ed3b9448f3160832bcc6aff3149f",
        "label": "left"
      },
      "right": {
        "source": "file",
        "uri": "<input.right.uri>",
        "content_sha256": "a97ee89330bfd8ee96cf9e19d4c7453edd342e16eebf5637c46b942730ec1339",
        "label": "right"
      }
    },
    "summary": {
      "verdict": "incompatible",
      "coverage": {
        "total_operations": 2,
        "paired": 1,
        "only_left": 1,
        "only_right": 0,
        "paired_via": {
          "direct": 1,
          "alias": 0,
          "satisfies": 0
        }
      },
      "counts": {
        "operation.removed": 1
      },
      "categories": {
        "breaking": 1,
        "non_breaking": 0,
        "compliance": 0,
        "structural": 0
      }
    },
    "operations": [
      {
        "status": "paired",
        "left": {
          "key": "check",
          "pointer": "/operations/check"
        },
        "right": {
          "key": "check",
          "pointer": "/operations/check"
        },
        "match": {
          "strategy": "direct",
          "left": "check",
          "right": "check"
        },
        "output": {
          "verdict": "identical",
          "direction": "output",
          "reasons": []
        },
        "findings": []
      },
      {
        "status": "only_left",
        "left": {
          "key": "old",
          "pointer": "/operations/old"
        },
        "findings": [
          {
            "kind": "operation.removed",
            "category": [
              "breaking"
            ],
            "severity": "error",
            "location": {
              "side": "left",
              "pointer": "/operations/old"
            },
            "before": {
              "output": {
                "type": "string"
              }
            }
          }
        ]
      }
    ],
    "schemas": [],
    "metadata": [],
    "sources": [],
    "bindings": [],
    "transforms": [],
    "security": [],
    "suppressed": []
  }
}
