{
  "version": "ob-comparison-fixture/v1",
  "description": "Output schema raises minimum; implementation returns a narrower numeric range.",
  "left": {
    "openbindings": "0.2.0",
    "operations": {
      "check": {
        "output": {
          "type": "number",
          "minimum": 0
        }
      }
    }
  },
  "right": {
    "openbindings": "0.2.0",
    "operations": {
      "check": {
        "output": {
          "type": "number",
          "minimum": 10
        }
      }
    }
  },
  "mode": "subsume",
  "options": {
    "profile": "OB-2020-12"
  },
  "expected": {
    "format_version": "ob-comparison-report/v1",
    "profile": "OB-2020-12@<corpus-sha>",
    "mode": "subsume",
    "tool": {
      "name": "ob",
      "version": "<tool.version>"
    },
    "generated_at": "<generated_at>",
    "inputs": {
      "left": {
        "source": "file",
        "uri": "<input.left.uri>",
        "content_sha256": "814e94572afb81f4038b9adb94e64e2957bc75e2f3eadbec48ba63fb9067cc03",
        "label": "left"
      },
      "right": {
        "source": "file",
        "uri": "<input.right.uri>",
        "content_sha256": "987eca4f6fab0194d6819cfc09a40b2862e1bc5a331ed49ff78a45d307dc9c77",
        "label": "right"
      }
    },
    "summary": {
      "verdict": "compatible",
      "coverage": {
        "total_operations": 1,
        "paired": 1,
        "only_left": 0,
        "only_right": 0,
        "paired_via": {
          "direct": 1,
          "alias": 0,
          "satisfies": 0
        }
      },
      "counts": {
        "numeric.minimum.tightened": 1
      },
      "categories": {
        "breaking": 0,
        "non_breaking": 1,
        "compliance": 0,
        "structural": 0
      }
    },
    "operations": [
      {
        "status": "paired",
        "left": {
          "key": "check",
          "pointer": "/operations/check"
        },
        "right": {
          "key": "check",
          "pointer": "/operations/check"
        },
        "match": {
          "strategy": "direct",
          "left": "check",
          "right": "check"
        },
        "output": {
          "verdict": "compatible",
          "direction": "output",
          "reasons": [
            {
              "kind": "numeric.minimum.tightened",
              "pointer": "/operations/check/output/minimum",
              "side": "right"
            }
          ]
        },
        "findings": [
          {
            "kind": "numeric.minimum.tightened",
            "category": [
              "non_breaking"
            ],
            "severity": "warn",
            "location": {
              "side": "right",
              "pointer": "/operations/check/output/minimum"
            },
            "before": 0,
            "after": 10
          }
        ]
      }
    ],
    "schemas": [],
    "metadata": [],
    "sources": [],
    "bindings": [],
    "transforms": [],
    "security": [],
    "suppressed": []
  }
}
