{
  "version": "ob-comparison-fixture/v1",
  "description": "Output schema drops a required property; implementation may omit a field the contract guaranteed.",
  "left": {
    "openbindings": "0.2.0",
    "operations": {
      "check": {
        "output": {
          "type": "object",
          "properties": {
            "id": {
              "type": "string"
            }
          },
          "required": [
            "id"
          ]
        }
      }
    }
  },
  "right": {
    "openbindings": "0.2.0",
    "operations": {
      "check": {
        "output": {
          "type": "object",
          "properties": {
            "id": {
              "type": "string"
            }
          }
        }
      }
    }
  },
  "mode": "subsume",
  "options": {
    "profile": "OB-2020-12"
  },
  "expected": {
    "format_version": "ob-comparison-report/v1",
    "profile": "OB-2020-12@<corpus-sha>",
    "mode": "subsume",
    "tool": {
      "name": "ob",
      "version": "<tool.version>"
    },
    "generated_at": "<generated_at>",
    "inputs": {
      "left": {
        "source": "file",
        "uri": "<input.left.uri>",
        "content_sha256": "eea05175756486f86385e01da03ec54b157cd54968fff2a6c9d466d400aef59a",
        "label": "left"
      },
      "right": {
        "source": "file",
        "uri": "<input.right.uri>",
        "content_sha256": "d8458edc0c752925013767203e7302f3e693a06ccd17d6c1618ec141360aeaad",
        "label": "right"
      }
    },
    "summary": {
      "verdict": "incompatible",
      "coverage": {
        "total_operations": 1,
        "paired": 1,
        "only_left": 0,
        "only_right": 0,
        "paired_via": {
          "direct": 1,
          "alias": 0,
          "satisfies": 0
        }
      },
      "counts": {
        "required.removed": 1
      },
      "categories": {
        "breaking": 1,
        "non_breaking": 0,
        "compliance": 0,
        "structural": 0
      }
    },
    "operations": [
      {
        "status": "paired",
        "left": {
          "key": "check",
          "pointer": "/operations/check"
        },
        "right": {
          "key": "check",
          "pointer": "/operations/check"
        },
        "match": {
          "strategy": "direct",
          "left": "check",
          "right": "check"
        },
        "output": {
          "verdict": "incompatible",
          "direction": "output",
          "reasons": [
            {
              "kind": "required.removed",
              "pointer": "/operations/check/output/required/0",
              "side": "left"
            }
          ]
        },
        "findings": [
          {
            "kind": "required.removed",
            "category": [
              "breaking"
            ],
            "severity": "error",
            "location": {
              "side": "left",
              "pointer": "/operations/check/output/required/0"
            },
            "before": [
              "id"
            ],
            "after": []
          }
        ]
      }
    ],
    "schemas": [],
    "metadata": [],
    "sources": [],
    "bindings": [],
    "transforms": [],
    "security": [],
    "suppressed": []
  }
}
