{
  "version": "ob-comparison-fixture/v1",
  "description": "Two operations: one identical, one incompatible. Summary verdict collapses to incompatible.",
  "left": {
    "openbindings": "0.2.0",
    "operations": {
      "alpha": {
        "output": {
          "type": "string"
        }
      },
      "beta": {
        "output": {
          "enum": [
            "created",
            "done"
          ]
        }
      }
    }
  },
  "right": {
    "openbindings": "0.2.0",
    "operations": {
      "alpha": {
        "output": {
          "type": "string"
        }
      },
      "beta": {
        "output": {
          "enum": [
            "created",
            "done",
            "archived"
          ]
        }
      }
    }
  },
  "mode": "subsume",
  "options": {
    "profile": "OB-2020-12"
  },
  "expected": {
    "format_version": "ob-comparison-report/v1",
    "profile": "OB-2020-12@<corpus-sha>",
    "mode": "subsume",
    "tool": {
      "name": "ob",
      "version": "<tool.version>"
    },
    "generated_at": "<generated_at>",
    "inputs": {
      "left": {
        "source": "file",
        "uri": "<input.left.uri>",
        "content_sha256": "6806c2dd9be189aac02f2a4951373e12d1a3c54d7476a689ee67324cc60a4767",
        "label": "left"
      },
      "right": {
        "source": "file",
        "uri": "<input.right.uri>",
        "content_sha256": "d91f72f64a150ff56993440cb5157f49345da432b55b9093bf08fc16f00342ae",
        "label": "right"
      }
    },
    "summary": {
      "verdict": "incompatible",
      "coverage": {
        "total_operations": 2,
        "paired": 2,
        "only_left": 0,
        "only_right": 0,
        "paired_via": {
          "direct": 2,
          "alias": 0,
          "satisfies": 0
        }
      },
      "counts": {
        "enum.value.added": 1
      },
      "categories": {
        "breaking": 1,
        "non_breaking": 0,
        "compliance": 0,
        "structural": 0
      }
    },
    "operations": [
      {
        "status": "paired",
        "left": {
          "key": "alpha",
          "pointer": "/operations/alpha"
        },
        "right": {
          "key": "alpha",
          "pointer": "/operations/alpha"
        },
        "match": {
          "strategy": "direct",
          "left": "alpha",
          "right": "alpha"
        },
        "output": {
          "verdict": "identical",
          "direction": "output",
          "reasons": []
        },
        "findings": []
      },
      {
        "status": "paired",
        "left": {
          "key": "beta",
          "pointer": "/operations/beta"
        },
        "right": {
          "key": "beta",
          "pointer": "/operations/beta"
        },
        "match": {
          "strategy": "direct",
          "left": "beta",
          "right": "beta"
        },
        "output": {
          "verdict": "incompatible",
          "direction": "output",
          "reasons": [
            {
              "kind": "enum.value.added",
              "pointer": "/operations/beta/output/enum/2",
              "side": "right"
            }
          ]
        },
        "findings": [
          {
            "kind": "enum.value.added",
            "category": [
              "breaking"
            ],
            "severity": "error",
            "location": {
              "side": "right",
              "pointer": "/operations/beta/output/enum/2"
            },
            "before": [
              "created",
              "done"
            ],
            "after": [
              "created",
              "done",
              "archived"
            ]
          }
        ]
      }
    ],
    "schemas": [],
    "metadata": [],
    "sources": [],
    "bindings": [],
    "transforms": [],
    "security": [],
    "suppressed": []
  }
}
