{
  "version": "ob-comparison-fixture/v1",
  "description": "Two operations: one indeterminate, one incompatible. Summary verdict collapses to indeterminate.",
  "left": {
    "openbindings": "0.2.0",
    "operations": {
      "alpha": {
        "input": {
          "type": "number",
          "exclusiveMinimum": true
        }
      },
      "beta": {
        "output": {
          "enum": [
            "created",
            "done"
          ]
        }
      }
    }
  },
  "right": {
    "openbindings": "0.2.0",
    "operations": {
      "alpha": {
        "input": {
          "type": "number",
          "minimum": 0
        }
      },
      "beta": {
        "output": {
          "enum": [
            "created",
            "done",
            "archived"
          ]
        }
      }
    }
  },
  "mode": "subsume",
  "options": {
    "profile": "OB-2020-12"
  },
  "expected": {
    "format_version": "ob-comparison-report/v1",
    "profile": "OB-2020-12@<corpus-sha>",
    "mode": "subsume",
    "tool": {
      "name": "ob",
      "version": "<tool.version>"
    },
    "generated_at": "<generated_at>",
    "inputs": {
      "left": {
        "source": "file",
        "uri": "<input.left.uri>",
        "content_sha256": "662aa3cb1e0691d355d96e36fc0c3c55a93c16fba170ffa225ad0a770d5a7dba",
        "label": "left"
      },
      "right": {
        "source": "file",
        "uri": "<input.right.uri>",
        "content_sha256": "93af309d8576cc61e93261a7a3549bfbec26afe4cf7932ead2e5d8f2a9a2c81b",
        "label": "right"
      }
    },
    "summary": {
      "verdict": "indeterminate",
      "coverage": {
        "total_operations": 2,
        "paired": 2,
        "only_left": 0,
        "only_right": 0,
        "paired_via": {
          "direct": 2,
          "alias": 0,
          "satisfies": 0
        }
      },
      "counts": {
        "profile.schema.not_2020_12": 1,
        "enum.value.added": 1
      },
      "categories": {
        "breaking": 1,
        "non_breaking": 0,
        "compliance": 0,
        "structural": 1
      }
    },
    "operations": [
      {
        "status": "paired",
        "left": {
          "key": "alpha",
          "pointer": "/operations/alpha"
        },
        "right": {
          "key": "alpha",
          "pointer": "/operations/alpha"
        },
        "match": {
          "strategy": "direct",
          "left": "alpha",
          "right": "alpha"
        },
        "input": {
          "verdict": "indeterminate",
          "direction": "input",
          "reasons": [
            {
              "kind": "profile.schema.not_2020_12",
              "pointer": "/operations/alpha/input/exclusiveMinimum",
              "side": "left"
            }
          ]
        },
        "findings": [
          {
            "kind": "profile.schema.not_2020_12",
            "category": [
              "structural"
            ],
            "severity": "error",
            "location": {
              "side": "left",
              "pointer": "/operations/alpha/input/exclusiveMinimum"
            },
            "before": true
          }
        ]
      },
      {
        "status": "paired",
        "left": {
          "key": "beta",
          "pointer": "/operations/beta"
        },
        "right": {
          "key": "beta",
          "pointer": "/operations/beta"
        },
        "match": {
          "strategy": "direct",
          "left": "beta",
          "right": "beta"
        },
        "output": {
          "verdict": "incompatible",
          "direction": "output",
          "reasons": [
            {
              "kind": "enum.value.added",
              "pointer": "/operations/beta/output/enum/2",
              "side": "right"
            }
          ]
        },
        "findings": [
          {
            "kind": "enum.value.added",
            "category": [
              "breaking"
            ],
            "severity": "error",
            "location": {
              "side": "right",
              "pointer": "/operations/beta/output/enum/2"
            },
            "before": [
              "created",
              "done"
            ],
            "after": [
              "created",
              "done",
              "archived"
            ]
          }
        ]
      }
    ],
    "schemas": [],
    "metadata": [],
    "sources": [],
    "bindings": [],
    "transforms": [],
    "security": [],
    "suppressed": []
  }
}
